<?xml version="1.0" encoding="UTF-8"?><!-- Describes a directory with his content 	Content :		- DirectorySet : directories list		- fileSet : files list		Each File is described with the following details :	- Classes list	- Package	- Imports ...		Please read the official documentation to obtain more details--><directory absolutePath="" name="" xmlns:xsi="http://www.w3.org/2001/XMLSchema-instance" xsi:noNamespaceSchemaLocation="../XSD Schemas/DirectoryFile.xsd">	<directorySet>		<dir name="" descriptionFile=""/>	</directorySet>	<fileSet>		<file name="" absolutePath="">			<importSet>				<import value=""/>				<import value=""/>			</importSet>			<classSet>				<class name="" package="" modifier="" parentClass="">
				<!-- TODO Changer les modifiers en static=false|true final=false|true et visibility="" -->
					<implementedInterfaceSet>
						<interface name="" />
					</implementedInterfaceSet>					<attributeSet>						<attribute name="" type="" modifier=""/>
						<!-- TODO Changer les modifiers en static=false|true final=false|true et visibility="" -->					</attributeSet>					<methodSet>						<method name="" returnType="" modifier="">							<parameterSet>								<parameter name="" type="" modifier=""/>							</parameterSet>						</method>					</methodSet>				</class>			</classSet>		</file>	</fileSet></directory>