<?xml version="1.0" encoding="UTF-8"?><!-- Describes a directory with his content 	Content :		- DirectorySet : directories list		- fileSet : files list		Each File is described with the following details :	- Classes list	- Package	- Imports ...		Please read the official documentation to obtain more details--><directory absolutePath="/src/sampleTestProject/" name="sampleProject" xmlns:xsi="http://www.w3.org/2001/XMLSchema-instance" xsi:noNamespaceSchemaLocation="/xml/XSD Schemas/DirectoryFile.xsd">		<directorySet>		<dir name="sample1" descriptionFile="This is the description of the sample directory sample1"/>		<dir name="sample2" descriptionFile="This is the description of the sample directory sample2"/>		<dir name="otherSample" descriptionFile="Another description of a sample Directory"/>	</directorySet>			<fileSet>				<file name="sampleClass1.java" absolutePath="/src/sampleTestProject/sampleClass1.java">						<importSet>				<import value="java.util"/>				<import value="java.lang"/>			</importSet>			<classSet>				<class name="SampleClass1" package="samplePackage" modifier="public" parentClass="">
				<!-- TODO Changer les modifiers en static=false|true final=false|true et visibility="" -->
					<implementedInterfaceSet>
						<interface name="ISampleInterface1" />						<interface name="ISampleInterface2" />
					</implementedInterfaceSet>					<attributeSet>						<attribute name="attribute1" type="int" modifier="private"/>						<attribute name="attribute2" type="string" modifier="private"/>
						<!-- TODO Changer les modifiers en static=false|true final=false|true et visibility="" -->					</attributeSet>					<methodSet>						<method name="MethodA" returnType="void" modifier="public">							<parameterSet>								<parameter name="param1" type="string" modifier=""/>							</parameterSet>						</method>						<method name="MethodB" returnType="int" modifier="public" />					</methodSet>				</class>								<class name="SampleClass2" package="samplePackage2" modifier="private" parentClass="">				<!-- TODO Changer les modifiers en static=false|true final=false|true et visibility="" -->					<implementedInterfaceSet>						<interface name="ISampleInterface2" />					</implementedInterfaceSet>					<attributeSet>						<attribute name="attribute1" type="int" modifier="private"/>						<!-- TODO Changer les modifiers en static=false|true final=false|true et visibility="" -->					</attributeSet>					<methodSet>						<method name="MethodC" returnType="void" modifier="public" />						<method name="MethodD" returnType="int" modifier="public" />					</methodSet>				</class>			</classSet>			</file>				<file name="sampleClass2.java" absolutePath="/src/sampleTestProject/sampleClass1.java">						<importSet>				<import value="java.util"/>				<import value="java.lang"/>			</importSet>			<classSet>				<class name="SampleClass2" package="samplePackage" modifier="public" parentClass="">				<!-- TODO Changer les modifiers en static=false|true final=false|true et visibility="" -->					<implementedInterfaceSet>						<interface name="ISampleInterface1" />						<interface name="ISampleInterface2" />					</implementedInterfaceSet>					<attributeSet>						<attribute name="attribute1" type="int" modifier="private"/>						<attribute name="attribute2" type="string" modifier="private"/>						<!-- TODO Changer les modifiers en static=false|true final=false|true et visibility="" -->					</attributeSet>					<methodSet>						<method name="MethodA" returnType="void" modifier="public">							<parameterSet>								<parameter name="param1" type="string" modifier=""/>							</parameterSet>						</method>						<method name="MethodB" returnType="int" modifier="public" />					</methodSet>				</class>								<class name="SampleClass2" package="samplePackage2" modifier="public" parentClass="">				<!-- TODO Changer les modifiers en static=false|true final=false|true et visibility="" -->					<implementedInterfaceSet>						<interface name="ISampleInterface2" />					</implementedInterfaceSet>					<attributeSet>						<attribute name="attribute1" type="int" modifier="private"/>						<!-- TODO Changer les modifiers en static=false|true final=false|true et visibility="" -->					</attributeSet>					<methodSet>						<method name="MethodC" returnType="void" modifier="public" />						<method name="MethodD" returnType="int" modifier="public" />					</methodSet>				</class>			</classSet>			</file>			</fileSet></directory>